<?xml version="1.0"?>

<tables xmlns:xsi="http://www.w3.org/2001/XMLSchema-instance"
        xsi:noNamespaceSchemaLocation='whq-tables-schema.xsd'>
  <table name="ChatGPT Dungeon Events">
    <event id="gpt-glyph-of-hashut" />
    <event id="gpt-ratling-snare" />
    <event id="gpt-orc-drop-net" />
    <event id="gpt-falling-idol" />
    <event id="gpt-grudge-axes" />
    <event id="gpt-bad-moon-spores" />
    <event id="gpt-wardstone-spark" />
    <event id="gpt-poison-censer" />
    <event id="gpt-blood-runes" />
    <event id="gpt-knife-slot" />
    <event id="gpt-false-floor" />
    <event id="gpt-screaming-skulls" />
    <event id="gpt-cold-fire" />
    <event id="gpt-blackpowder-cache" />
    <event id="gpt-midden-leeches" />
    <event id="gpt-shrine-of-morr" />
    <event id="gpt-dwarfen-waystones" />
    <event id="gpt-skaven-scratchings" />
    <event id="gpt-bretonnian-vow" />
    <event id="gpt-pilgrim-bones" />
    <event id="gpt-smugglers-cache" />
    <event id="gpt-lost-lamplighter" />
    <event id="gpt-echo-of-nagash" />
    <event id="gpt-squig-mushroom-bed" />
    <event id="gpt-river-of-filth" />
    <event id="gpt-sealed-ossuary" />
    <event id="gpt-mercenary-map" />
    <event id="gpt-ancestor-mask" />
    <event id="gpt-sigmarite-reliquary" />
    <event id="gpt-ghoul-feast" />
    <event id="gpt-runes-of-warning" />
    <event id="gpt-thief-in-the-dark" />
    <event id="gpt-fungus-brew" />
    <event id="gpt-forgotten-gaol" />
    <event id="gpt-chaos-dwarf-ledger" />
    <event id="gpt-moonlit-well" />
    <event id="gpt-plague-cart" />
    <event id="gpt-watchers-in-the-stone" />
    <event id="gpt-last-stand" />
    <event id="gpt-tunnel-tax" />
    <event id="gpt-hermit-seer" />
    <event id="gpt-grave-sand" />
    <event id="gpt-echoing-horn" />
    <event id="gpt-vault-of-oaths" />
    <event id="gpt-hunters-mark" />
    <event id="gpt-ghostly-masons" />
    <event id="gpt-silent-bell" />
    <event id="gpt-banner-in-the-dust" />
    <event id="gpt-lahmian-mirror" />
    <event id="gpt-slayers-cairn" />
    <event id="gpt-brimstone-vent" />
    <event id="gpt-gutter-runner-dart" />
    <event id="gpt-doomwheel-surge" />
    <event id="gpt-frost-rime-trap" />
    <event id="gpt-chain-flail-pendulum" />
    <event id="gpt-sunken-step" />
    <event id="gpt-runeflare-lens" />
    <event id="gpt-bat-swarm-cloud" />
    <event id="gpt-cauldron-spill" />
    <event id="gpt-spiteful-echo" />
    <event id="gpt-bone-shards" />
    <event id="gpt-iron-maiden-door" />
    <event id="gpt-censer-mites" />
    <event id="gpt-furnace-backdraft" />
    <event id="gpt-witch-sigil" />
    <event id="gpt-shallyan-font" />
    <event id="gpt-ranalds-cache" />
    <event id="gpt-ostland-standard" />
    <event id="gpt-kislevite-charm" />
    <event id="gpt-taal-shrine" />
    <event id="gpt-ulrics-embers" />
    <event id="gpt-cartographers-mark" />
    <event id="gpt-middenheim-relief" />
    <event id="gpt-estalian-duelist" />
    <event id="gpt-tilean-contract" />
    <event id="gpt-nehekharan-jar" />
    <event id="gpt-abbot-skeleton" />
    <event id="gpt-amber-wizard-tracks" />
    <event id="gpt-vampires-coffin" />
    <event id="gpt-ironbreakers-oath" />
    <event id="gpt-waywatcher-sign" />
    <event id="gpt-flagellant-graffiti" />
    <event id="gpt-deep-delver-tools" />
    <event id="gpt-river-watch-rune" />
    <event id="gpt-beastmen-totem" />
    <event id="gpt-forgotten-chantry" />
    <event id="gpt-hexensnacht-candles" />
    <event id="gpt-dead-messenger" />
    <event id="gpt-stolen-idol" />
    <event id="gpt-warded-arch" />
    <event id="gpt-mad-prophet" />
    <event id="gpt-buried-powder-horn" />
    <event id="gpt-emerald-moss" />
    <event id="gpt-iron-keyring" />
    <event id="gpt-seer-stone" />
    <event id="gpt-marienburg-lockbox" />
    <event id="gpt-black-ark-trinket" />
    <event id="gpt-sylvan-whisper" />
    <event id="gpt-morrs-lantern" />
    <event id="gpt-wolfshead-helm" />
  </table>
</tables>
