<?xml version="1.0"?>

<tables xmlns:xsi="http://www.w3.org/2001/XMLSchema-instance"
        xsi:noNamespaceSchemaLocation='whq-tables-schema.xsd'>
  <table name="Roleplay Book - Dungeon Treasure Table" kind="treasure">
    <event id="rpb-treasure-dungeon-heartseeker" />
    <event id="rpb-treasure-dungeon-berserker-sword" />
    <event id="rpb-treasure-dungeon-bronze-sigil-sword" />
    <event id="rpb-treasure-dungeon-boots-of-quargskin" />
    <event id="rpb-treasure-dungeon-sword-of-ensorcelled-iron" />
    <event id="rpb-treasure-dungeon-biting-blade" />
    <event id="rpb-treasure-dungeon-sword-of-stone" />
    <event id="rpb-treasure-dungeon-blade-of-leaping-copper" />
    <event id="rpb-treasure-dungeon-blade-of-couronne" />
    <event id="rpb-treasure-dungeon-magic-sword" />
    <event id="rpb-treasure-dungeon-relic-blade" />
    <event id="rpb-treasure-dungeon-blade-of-slicing" />
    <event id="rpb-treasure-dungeon-darting-steel-blades" />
    <event id="rpb-treasure-dungeon-magical-quiver" />
    <event id="rpb-treasure-dungeon-bone-blade" />
    <event id="rpb-treasure-dungeon-eltharions-bow" />
    <event id="rpb-treasure-dungeon-sword-of-might" />
    <event id="rpb-treasure-dungeon-cloak-of-stealth" />
    <event id="rpb-treasure-dungeon-obsidian-blade" />
    <event id="rpb-treasure-dungeon-giant-slayer" />
    <event id="rpb-treasure-dungeon-sword-of-resilience" />
    <event id="rpb-treasure-dungeon-helmet-of-farseeing" />
    <event id="rpb-treasure-dungeon-parrying-blade" />
    <event id="rpb-treasure-dungeon-deathsword" />
    <event id="rpb-treasure-dungeon-dragonhelm" />
    <event id="rpb-treasure-dungeon-blade-of-sea-gold" />
    <event id="rpb-treasure-dungeon-ogre-slayer" />
    <event id="rpb-treasure-dungeon-blessed-sword" />
    <event id="rpb-treasure-dungeon-grey-armour-of-eshkalon" />
    <event id="rpb-treasure-dungeon-armour-of-fortune" />
    <event id="rpb-treasure-dungeon-undead-bane" />
    <event id="rpb-treasure-dungeon-dispel-magic-scroll" />
    <event id="rpb-treasure-dungeon-energy-jewel" />
    <event id="rpb-treasure-dungeon-amulet-of-fury" />
    <event id="rpb-treasure-dungeon-arrow-of-slaying" />
    <event id="rpb-treasure-dungeon-crown-of-night" />
    <event id="rpb-treasure-dungeon-talisman-of-jet" />
    <event id="rpb-treasure-dungeon-spell-ring" />
    <event id="rpb-treasure-dungeon-destroy-magic-scroll" />
    <event id="rpb-treasure-dungeon-cloak-of-invisibility" />
    <event id="rpb-treasure-dungeon-arrows-of-piercing" />
    <event id="rpb-treasure-dungeon-the-ring-of-dadaan" />
    <event id="rpb-treasure-dungeon-boots-of-leaping" />
    <event id="rpb-treasure-dungeon-boots-of-swiftness" />
    <event id="rpb-treasure-dungeon-boots-of-flight" />
    <event id="rpb-treasure-dungeon-boots-of-battle" />
    <event id="rpb-treasure-dungeon-potion-of-flight" />
    <event id="rpb-treasure-dungeon-potion-of-healing" />
    <event id="rpb-treasure-dungeon-potion-of-invisibility" />
    <event id="rpb-treasure-dungeon-potion-of-strength" />
    <event id="rpb-treasure-dungeon-potion-of-disguise" />
    <event id="rpb-treasure-dungeon-potion-of-water-walking" />
    <event id="rpb-treasure-dungeon-potion-of-toughness" />
    <event id="rpb-treasure-dungeon-protection-ring" />
    <event id="rpb-treasure-dungeon-ring-of-invisibility" />
    <event id="rpb-treasure-dungeon-ring-of-power" />
    <event id="rpb-treasure-dungeon-arkais-powder" />
    <event id="rpb-treasure-dungeon-charm-of-learning" />
    <event id="rpb-treasure-dungeon-ring-of-sure-seeing" />
    <event id="rpb-treasure-dungeon-gems-of-life" />
    <event id="rpb-treasure-dungeon-bracelet-of-transformation" />
    <event id="rpb-treasure-dungeon-lifestone" />
    <event id="rpb-treasure-dungeon-bracelet-of-ashain" />
    <event id="rpb-treasure-dungeon-circlet-of-wrath" />
    <event id="rpb-treasure-dungeon-belt-of-gagron" />
    <event id="rpb-treasure-dungeon-stone-of-transmutation" />
    <event id="rpb-treasure-dungeon-gauntlet-of-damzhar" />
  </table>
  <table name="Roleplay Book - Objective Room Treasure Table" kind="treasure">
    <event id="rpb-treasure-objective-ring-of-seeking" />
    <event id="rpb-treasure-objective-chalice-of-sorcery" />
    <event id="rpb-treasure-objective-enchanted-jade-amulet" />
    <event id="rpb-treasure-objective-book-of-arcane-knowledge" />
    <event id="rpb-treasure-objective-brooch-of-power" />
    <event id="rpb-treasure-objective-wand-of-jade" />
    <event id="rpb-treasure-objective-dawnstone" />
    <event id="rpb-treasure-objective-rune-of-death" />
    <event id="rpb-treasure-objective-crown-of-sorcery" />
    <event id="rpb-treasure-objective-talisman-of-obsidian" />
    <event id="rpb-treasure-objective-tablet-of-adain" />
    <event id="rpb-treasure-objective-armour-of-taakan" />
    <event id="rpb-treasure-objective-wand-of-diabolum" />
    <event id="rpb-treasure-objective-ring-of-cheshnakk" />
    <event id="rpb-treasure-objective-the-hammer-of-sigmar" />
    <event id="rpb-treasure-objective-blade-of-leaping-gold" />
    <event id="rpb-treasure-objective-frostblade" />
    <event id="rpb-treasure-objective-rending-sword" />
    <event id="rpb-treasure-objective-sword-of-destruction" />
    <event id="rpb-treasure-objective-bane-sword" />
    <event id="rpb-treasure-objective-dragon-sword" />
    <event id="rpb-treasure-objective-hellfire-sword" />
    <event id="rpb-treasure-objective-gromril-blade" />
    <event id="rpb-treasure-objective-hydra-sword" />
    <event id="rpb-treasure-objective-sword-of-vengeance" />
    <event id="rpb-treasure-objective-axe-of-slaying" />
    <event id="rpb-treasure-objective-sword-of-heroes" />
    <event id="rpb-treasure-objective-blade-of-leaping-bronze" />
    <event id="rpb-treasure-objective-bow-of-loren" />
    <event id="rpb-treasure-objective-surefire-bow" />
    <event id="rpb-treasure-objective-enchanted-shield" />
    <event id="rpb-treasure-objective-armour-of-meteoric-iron" />
    <event id="rpb-treasure-objective-shield-of-ptolos" />
    <event id="rpb-treasure-objective-armour-of-dargan" />
    <event id="rpb-treasure-objective-spelleater-rune" />
    <event id="rpb-treasure-objective-the-staff-of-command" />
  </table>
</tables>
