<?xml version="1.0"?>

<tables xmlns:xsi="http://www.w3.org/2001/XMLSchema-instance"
        xsi:noNamespaceSchemaLocation='whq-tables-schema.xsd'>
  <table name="lm - Travel Hazards Table" kind="travel">
    <event id="lm-travel-imminent-danger-11-12-man-eating-tiger" />
    <event id="lm-travel-imminent-danger-13-14-kidnapped" />
    <event id="lm-travel-imminent-danger-15-16-dragons" />
    <event id="lm-travel-imminent-danger-21-22-harpies" />
    <event id="lm-travel-imminent-danger-23-24-vanished" />
    <event id="lm-travel-imminent-danger-25-26-collapsing-bridge" />
    <event id="lm-travel-imminent-danger-31-32-assassin" />
    <event id="lm-travel-imminent-danger-33-34-hungry-wolves" />
    <event id="lm-travel-imminent-danger-35-36-village-of-the-damned" />
    <event id="lm-travel-imminent-danger-41-42-evil-combatants" />
    <event id="lm-travel-imminent-danger-43-44-river-sprites" />
    <event id="lm-travel-imminent-danger-45-46-ambush" />
    <event id="lm-travel-imminent-danger-51-52-treasure-or-your-life" />
    <event id="lm-travel-imminent-danger-53-54-witch-doctor" />
    <event id="lm-travel-imminent-danger-55-56-food-shortage" />
    <event id="lm-travel-imminent-danger-61-62-brigands" />
    <event id="lm-travel-imminent-danger-63-64-hornets-nest" />
    <event id="lm-travel-imminent-danger-65-66-horsemen" />
    <event id="lm-travel-act-of-nature-11-12-avalanche" />
    <event id="lm-travel-act-of-nature-13-14-quake" />
    <event id="lm-travel-act-of-nature-15-16-heatwave" />
    <event id="lm-travel-act-of-nature-21-22-tornado" />
    <event id="lm-travel-act-of-nature-23-24-plague" />
    <event id="lm-travel-act-of-nature-25-26-volcanic-eruption" />
    <event id="lm-travel-act-of-nature-31-32-famine" />
    <event id="lm-travel-act-of-nature-33-34-forest-fire" />
    <event id="lm-travel-act-of-nature-35-36-lightning" />
    <event id="lm-travel-act-of-nature-41-42-flood" />
    <event id="lm-travel-act-of-nature-43-44-hailstorm" />
    <event id="lm-travel-act-of-nature-45-46-drought" />
    <event id="lm-travel-act-of-nature-51-52-blizzard" />
    <event id="lm-travel-act-of-nature-53-54-rockfall" />
    <event id="lm-travel-act-of-nature-55-56-erosion" />
    <event id="lm-travel-act-of-nature-61-62-dense-fog" />
    <event id="lm-travel-act-of-nature-63-64-glorious-weather" />
    <event id="lm-travel-act-of-nature-65-66-storm" />
    <event id="lm-travel-encounter-11-12-mystic" />
    <event id="lm-travel-encounter-13-14-religious-pilgrims" />
    <event id="lm-travel-encounter-15-16-pedlar" />
    <event id="lm-travel-encounter-21-22-caravan-guards" />
    <event id="lm-travel-encounter-23-24-waylaid" />
    <event id="lm-travel-encounter-25-26-prisoner" />
    <event id="lm-travel-encounter-31-32-merchants" />
    <event id="lm-travel-encounter-33-34-leprechaun" />
    <event id="lm-travel-encounter-35-36-stranger" />
    <event id="lm-travel-encounter-41-42-messenger" />
    <event id="lm-travel-encounter-43-44-dryads" />
    <event id="lm-travel-encounter-45-46-traveller" />
    <event id="lm-travel-encounter-51-52-guide" />
    <event id="lm-travel-encounter-53-54-gypsies" />
    <event id="lm-travel-encounter-55-56-drinks-and-deals" />
    <event id="lm-travel-encounter-61-62-militia" />
    <event id="lm-travel-encounter-63-64-travelling-minstrel" />
    <event id="lm-travel-encounter-65-66-adventuring-party" />
    <event id="lm-travel-structure-or-object-11-12-tower" />
    <event id="lm-travel-structure-or-object-13-14-chapel" />
    <event id="lm-travel-structure-or-object-15-16-strange-brew" />
    <event id="lm-travel-structure-or-object-21-22-dungeon-map" />
    <event id="lm-travel-structure-or-object-23-24-population-marker" />
    <event id="lm-travel-structure-or-object-25-26-wild-mushrooms" />
    <event id="lm-travel-structure-or-object-31-32-giant-nest" />
    <event id="lm-travel-structure-or-object-33-34-bad-map" />
    <event id="lm-travel-structure-or-object-35-36-monolith" />
    <event id="lm-travel-structure-or-object-41-42-damaged-wagon" />
    <event id="lm-travel-structure-or-object-43-44-death-note" />
    <event id="lm-travel-structure-or-object-45-46-hunting-snare" />
    <event id="lm-travel-structure-or-object-51-52-toll-station" />
    <event id="lm-travel-structure-or-object-53-54-tombstone" />
    <event id="lm-travel-structure-or-object-55-56-wagon-train" />
    <event id="lm-travel-structure-or-object-61-62-shrine" />
    <event id="lm-travel-structure-or-object-63-64-cottage" />
    <event id="lm-travel-structure-or-object-65-66-portal" />
    <event id="lm-travel-event-11-12-massacre" />
    <event id="lm-travel-event-13-14-fire" />
    <event id="lm-travel-event-15-16-commotion" />
    <event id="lm-travel-event-21-22-troupe" />
    <event id="lm-travel-event-23-24-unicorn" />
    <event id="lm-travel-event-25-26-guests" />
    <event id="lm-travel-event-31-32-feud" />
    <event id="lm-travel-event-33-34-distressed-villager" />
    <event id="lm-travel-event-35-36-foul-odour" />
    <event id="lm-travel-event-41-42-lost" />
    <event id="lm-travel-event-43-44-warrant" />
    <event id="lm-travel-event-45-46-which-road" />
    <event id="lm-travel-event-51-52-ceremony" />
    <event id="lm-travel-event-53-54-double-back" />
    <event id="lm-travel-event-55-56-mage-battle" />
    <event id="lm-travel-event-61-62-procession" />
    <event id="lm-travel-event-63-64-ransom" />
    <event id="lm-travel-event-65-66-fall" />
    <event id="lm-travel-place-11-12-graveyard" />
    <event id="lm-travel-place-13-14-fire-spring" />
    <event id="lm-travel-place-15-16-bandit-stronghold" />
    <event id="lm-travel-place-21-22-garden" />
    <event id="lm-travel-place-23-24-encampment" />
    <event id="lm-travel-place-25-26-beautiful-grove" />
    <event id="lm-travel-place-31-32-witchs-cave" />
    <event id="lm-travel-place-33-34-chasm" />
    <event id="lm-travel-place-35-36-pool-of-dreams" />
    <event id="lm-travel-place-41-42-checkpoint" />
    <event id="lm-travel-place-43-44-mysterious-hollow" />
    <event id="lm-travel-place-45-46-mausoleum" />
    <event id="lm-travel-place-51-52-magic-glade" />
    <event id="lm-travel-place-53-54-swamp" />
    <event id="lm-travel-place-55-56-den" />
    <event id="lm-travel-place-61-62-waterfall" />
    <event id="lm-travel-place-63-64-abandoned-mine" />
    <event id="lm-travel-place-65-66-battlefield" />
  </table>
</tables>
