<?xml version="1.0"?>

<tables xmlns:xsi="http://www.w3.org/2001/XMLSchema-instance"
        xsi:noNamespaceSchemaLocation='whq-tables-schema.xsd'>
  <table name="lm - Outside The Gates Events" kind="settlement">
    <event id="lm-outskirts-11-city-watch" />
    <event id="lm-outskirts-12-uneventful-day" />
    <event id="lm-outskirts-13-bandits" />
    <event id="lm-outskirts-14-an-adventure" />
    <event id="lm-outskirts-15-argil-s-magic-emporium" />
    <event id="lm-outskirts-16-beggars" />
    <event id="lm-outskirts-21-bard" />
    <event id="lm-outskirts-22-hay-wagon" />
    <event id="lm-outskirts-23-outbreak" />
    <event id="lm-outskirts-24-horse-thief" />
    <event id="lm-outskirts-25-riot" />
    <event id="lm-outskirts-26-the-black-tiger" />
    <event id="lm-outskirts-31-bad-omen" />
    <event id="lm-outskirts-32-wizard-s-apprentice" />
    <event id="lm-outskirts-33-uneventful-day" />
    <event id="lm-outskirts-34-curse" />
    <event id="lm-outskirts-35-an-adventure" />
    <event id="lm-outskirts-36-animal-rampage" />
    <event id="lm-outskirts-41-stench" />
    <event id="lm-outskirts-42-famished" />
    <event id="lm-outskirts-43-uneventful-day" />
    <event id="lm-outskirts-44-collapse" />
    <event id="lm-outskirts-45-spirit" />
    <event id="lm-outskirts-46-noble" />
    <event id="lm-outskirts-51-pests" />
    <event id="lm-outskirts-52-an-adventure" />
    <event id="lm-outskirts-53-pet-dog" />
    <event id="lm-outskirts-54-lepers" />
    <event id="lm-outskirts-55-madman" />
    <event id="lm-outskirts-56-uneventful-day" />
    <event id="lm-outskirts-61-mysterious-priest" />
    <event id="lm-outskirts-62-healer" />
    <event id="lm-outskirts-63-heavy-rains" />
    <event id="lm-outskirts-64-young-whelp" />
    <event id="lm-outskirts-65-an-adventure" />
    <event id="lm-outskirts-66-admittance" />
  </table>
  <table name="lm - Village Events" kind="settlement">
    <event id="lm-village-11-thrown-out" />
    <event id="lm-village-12-an-adventure" />
    <event id="lm-village-13-hunting" />
    <event id="lm-village-14-uneventful-day" />
    <event id="lm-village-15-witchcraft" />
    <event id="lm-village-16-nightmare" />
    <event id="lm-village-21-well" />
    <event id="lm-village-22-festival" />
    <event id="lm-village-23-family-heirloom" />
    <event id="lm-village-24-runaway" />
    <event id="lm-village-25-illness" />
    <event id="lm-village-26-an-adventure" />
    <event id="lm-village-31-uneventful-day" />
    <event id="lm-village-32-temple-donation" />
    <event id="lm-village-33-river-monster" />
    <event id="lm-village-34-snake" />
    <event id="lm-village-35-accident" />
    <event id="lm-village-36-pacifist" />
    <event id="lm-village-41-pickpocket" />
    <event id="lm-village-42-betrothed" />
    <event id="lm-village-43-friendly-villager" />
    <event id="lm-village-44-an-adventure" />
    <event id="lm-village-45-circus" />
    <event id="lm-village-46-gambling" />
    <event id="lm-village-51-beggars" />
    <event id="lm-village-52-pugilist" />
    <event id="lm-village-53-inheritance" />
    <event id="lm-village-54-fooled" />
    <event id="lm-village-55-riotous-living" />
    <event id="lm-village-56-an-honest-day-s-work" />
    <event id="lm-village-61-fire" />
    <event id="lm-village-62-troubadour" />
    <event id="lm-village-63-pet-dog" />
    <event id="lm-village-64-crime" />
    <event id="lm-village-65-uneventful-day" />
    <event id="lm-village-66-fearful-villagers" />
  </table>
  <table name="lm - Town Events" kind="settlement">
    <event id="lm-town-11-thrown-out" />
    <event id="lm-town-12-well" />
    <event id="lm-town-13-debt" />
    <event id="lm-town-14-investment" />
    <event id="lm-town-15-an-adventure" />
    <event id="lm-town-16-fire" />
    <event id="lm-town-21-fight" />
    <event id="lm-town-22-nightmare" />
    <event id="lm-town-23-drugged" />
    <event id="lm-town-24-family-heirloom" />
    <event id="lm-town-25-accident" />
    <event id="lm-town-26-uneventful-day" />
    <event id="lm-town-31-riotous-living" />
    <event id="lm-town-32-circus" />
    <event id="lm-town-33-crime" />
    <event id="lm-town-34-snake" />
    <event id="lm-town-35-witchcraft" />
    <event id="lm-town-36-pet-dog" />
    <event id="lm-town-41-fooled" />
    <event id="lm-town-42-inheritance" />
    <event id="lm-town-43-an-adventure" />
    <event id="lm-town-44-steam-bath" />
    <event id="lm-town-45-overturned-cart" />
    <event id="lm-town-46-sword-for-sale" />
    <event id="lm-town-51-beggars" />
    <event id="lm-town-52-troubadour" />
    <event id="lm-town-53-an-honest-day-s-work" />
    <event id="lm-town-54-robbery" />
    <event id="lm-town-55-uneventful-day" />
    <event id="lm-town-56-hunting" />
    <event id="lm-town-61-pickpocket" />
    <event id="lm-town-62-runaway" />
    <event id="lm-town-63-jealous-adventurer" />
    <event id="lm-town-64-join-the-watch" />
    <event id="lm-town-65-salesman" />
    <event id="lm-town-66-an-adventure" />
  </table>
  <table name="lm - City Events" kind="settlement">
    <event id="lm-city-11-thrown-out" />
    <event id="lm-city-12-uneventful-day" />
    <event id="lm-city-13-investment" />
    <event id="lm-city-14-pet-dog" />
    <event id="lm-city-15-cutpurse" />
    <event id="lm-city-16-bathhouse" />
    <event id="lm-city-21-an-adventure" />
    <event id="lm-city-22-an-honest-day-s-work" />
    <event id="lm-city-23-riotous-living" />
    <event id="lm-city-24-hunting" />
    <event id="lm-city-25-street-artists" />
    <event id="lm-city-26-counterfeit" />
    <event id="lm-city-31-false-accusation" />
    <event id="lm-city-32-wrestler" />
    <event id="lm-city-33-uneventful-day" />
    <event id="lm-city-34-robbery" />
    <event id="lm-city-35-troubadour" />
    <event id="lm-city-36-tax-collector" />
    <event id="lm-city-41-an-adventure" />
    <event id="lm-city-42-con-artist" />
    <event id="lm-city-43-old-friend" />
    <event id="lm-city-44-good-deed" />
    <event id="lm-city-45-beggars" />
    <event id="lm-city-46-relative" />
    <event id="lm-city-51-criminal" />
    <event id="lm-city-52-parade" />
    <event id="lm-city-53-accident" />
    <event id="lm-city-54-city-watch" />
    <event id="lm-city-55-street-urchin" />
    <event id="lm-city-56-salesman" />
    <event id="lm-city-61-duel" />
    <event id="lm-city-62-an-adventure" />
    <event id="lm-city-63-riot" />
    <event id="lm-city-64-trader" />
    <event id="lm-city-65-reward" />
    <event id="lm-city-66-assassin" />
  </table>
</tables>
